{
  "name": "default",
  "title": "Blog Toolkit",
  "subtitle": "Banк идей и инструментов для нишевого Instagram-блога",
  "brand": "@your_blog",
  "niche": "{твоя ниша — заполни в config/}",
  "audience": "{твоя аудитория}",
  "tone": "тёплый, дружелюбный, простыми словами, без канцелярита и AI-штампов",
  "emoji": "✨",
  "colors": {
    "primary": "#3f7d52",
    "primaryDark": "#2f5d3d",
    "accent": "#c98a3b",
    "bg": "#f4f7f2"
  },
  "rubrics": [
    {"id":"mistakes",    "name":"Ошибки новичков",     "emoji":"⚠️", "color":"#c97b3b"},
    {"id":"before-after","name":"До / после",          "emoji":"✨", "color":"#8a6cb0"},
    {"id":"lifehacks",   "name":"Лайфхаки",            "emoji":"💡", "color":"#d2a23a"},
    {"id":"personal",    "name":"Личное / за кадром",  "emoji":"☕", "color":"#a8745a"},
    {"id":"qa",          "name":"Вопрос-ответ",        "emoji":"❓", "color":"#4a90c2"},
    {"id":"seasonal",    "name":"Сезонное",            "emoji":"🍂", "color":"#c0703a"},
    {"id":"roundups",    "name":"Подборки",            "emoji":"📋", "color":"#5b8a8c"},
    {"id":"decor",       "name":"Атмосфера",           "emoji":"🖼️", "color":"#7e8b54"},
    {"id":"shopping",    "name":"Покупки и распаковки","emoji":"🛍️","color":"#bf6fa0"},
    {"id":"engagement",  "name":"Вовлечение (Stories)","emoji":"💬", "color":"#4aa3a0"}
  ],
  "trendQuery": "тренды Instagram Reels и контент про {niche} {month} {year}: популярные форматы видео, вирусные темы и хэштеги для блога",
  "packaging": {
    "positioning": "Помогаю {аудитория} разобраться в {ниша} — простыми словами, без занудства.",
    "name": "Имя · ключевые слова из ниши ✨",
    "bio_ru": "✨ Имя — кто я\n💡 Полезное про {ниша} простыми словами\n🌿 Без занудства, по-дружески\n👇 Забери бесплатный гайд",
    "bio_en": "✨ Name — what I do\n💡 Tips on {niche}, made simple\n💚 Honest & friendly\n👇 Grab my free starter guide",
    "link": "Мультиссылка (Taplink / Linktree):\n• Бесплатный гайд для новичка\n• Консультация / услуга\n• Отзывы\n• Telegram-канал",
    "highlights": "1) Старт — кто я и о чём блог\n2) База — основы по нише\n3) Ошибки — частые промахи новичков\n4) До/после — реальные кейсы\n5) Лайфхаки — короткие советы\n6) Подборки — топы\n7) Отзывы / благодарности\n8) Услуга / оффер",
    "pinned": "1) Знакомство: кто я + за чем подписываться\n2) Польза-карусель (то, что сохраняют)\n3) До/после или оффер",
    "visual": "Палитра: 2 основных + 1 акцентный цвет\nОбложки каруселей: один шаблон, один шрифт, крупный заголовок\nФото: дневной свет, чистый фон\nОдин пресет/фильтр на все фото",
    "avatar": "Твоё лицо (живые блоги растут лучше) или простой значок на однотонном фоне. Без мелких деталей.",
    "tone": "Тёплый, дружелюбный. Простыми словами, без латыни и канцелярита. Поддерживаю новичков: «у тебя получится»."
  }
}
