{
  "name": "fitness",
  "title": "Fit Studio",
  "subtitle": "Банк идей и инструментов для фитнес-блога",
  "brand": "@your_fit_blog",
  "niche": "домашние тренировки и здоровье",
  "audience": "новички в зале и мамы после декрета, которым не хватает времени",
  "tone": "поддерживающий, как тренер-подруга, простыми словами, без жаргона; пиши на «ты», в ед. числе глаголов",
  "emoji": "💪",
  "colors": {
    "primary": "#e85a4f",
    "primaryDark": "#b8453c",
    "accent": "#f0a830",
    "bg": "#fdf6f3"
  },
  "rubrics": [
    {"id":"workout",     "name":"Тренировка дня",     "emoji":"💪", "color":"#e85a4f"},
    {"id":"exercise-week","name":"Упражнение недели", "emoji":"🏋️", "color":"#b8453c"},
    {"id":"mistakes",    "name":"Ошибки новичков",    "emoji":"⚠️", "color":"#c97b3b"},
    {"id":"before-after","name":"До / после",         "emoji":"✨", "color":"#8a6cb0"},
    {"id":"nutrition",   "name":"Питание",            "emoji":"🥗", "color":"#5ba668"},
    {"id":"lifehacks",   "name":"Лайфхаки",           "emoji":"💡", "color":"#d2a23a"},
    {"id":"personal",    "name":"Личное / за кадром", "emoji":"☕", "color":"#a8745a"},
    {"id":"qa",          "name":"Вопрос-ответ",       "emoji":"❓", "color":"#4a90c2"},
    {"id":"recovery",    "name":"Восстановление",     "emoji":"😴", "color":"#7b6caa"},
    {"id":"roundups",    "name":"Подборки",           "emoji":"📋", "color":"#5b8a8c"},
    {"id":"motivation",  "name":"Мотивация",          "emoji":"🔥", "color":"#e8763a"},
    {"id":"gear",        "name":"Инвентарь и одежда", "emoji":"👟", "color":"#7e8b54"},
    {"id":"shopping",    "name":"Покупки и распаковки","emoji":"🛍️","color":"#bf6fa0"},
    {"id":"engagement",  "name":"Вовлечение (Stories)","emoji":"💬", "color":"#4aa3a0"}
  ],
  "trendQuery": "тренды Instagram Reels и контент про домашние тренировки и фитнес {month} {year}: популярные форматы видео, ходовые упражнения, вирусные темы и хэштеги для фитнес-блога",
  "packaging": {
    "positioning": "Помогаю занятым мамам и новичкам собрать фигуру дома, без зала и сложных схем 💪 Короткие тренировки, простое питание, по-человечески.",
    "name": "Имя · тренировки дома 💪",
    "bio_ru": "💪 Имя — тренер и мама\n🏋️ Тренировки дома без инвентаря\n🥗 Питание без диет и фанатизма\n👇 Забери бесплатный план на 7 дней",
    "bio_en": "💪 Name — coach & mom\n🏋️ Home workouts, no gym needed\n🥗 Eat smart, not strict\n👇 Grab my free 7-day plan",
    "link": "Taplink:\n• Бесплатный план тренировок на 7 дней\n• Персональная программа / онлайн-консультация\n• Отзывы клиентов\n• Telegram-канал",
    "highlights": "1) Старт — кто я и о чём блог\n2) База — техника основных упражнений\n3) Ошибки — частые промахи новичков\n4) До/после — результаты\n5) Питание — рецепты и подходы\n6) Подборки — тренировки на 10 минут и т.п.\n7) Отзывы / благодарности\n8) Программа / консультация",
    "pinned": "1) Знакомство: кто я + за чем подписываться\n2) Польза-карусель: «Тренировка дома без инвентаря»\n3) До/после или оффер: лучшая трансформация / программа",
    "visual": "Палитра: тёплый красный + охра + кремовый\nОбложки каруселей: один шаблон, один шрифт, крупный заголовок\nФото: дневной свет, домашняя обстановка\nОдин пресет/фильтр на все фото",
    "avatar": "Твоё лицо/портрет (живые блоги растут лучше) ИЛИ простой значок-гантеля на однотонном фоне.",
    "tone": "Поддерживающий, как тренер-подруга. Простыми словами, без жаргона. Честно про свои сложности. Поддерживаю новичков: «у тебя получится»."
  }
}
