{
  "name": "plants",
  "title": "Управа блога",
  "subtitle": "Банк идей и рубрик для блога о растениях",
  "brand": "@your_plants_blog",
  "niche": "комнатные растения",
  "audience": "новички и мамы, у которых «всё засыхает»",
  "tone": "тёплый, как подруга-мама, простыми словами, без латыни и канцелярита; пиши на «ты», в ед. числе глаголов («помни», «смотри»)",
  "emoji": "🪴",
  "colors": {
    "primary": "#3f7d52",
    "primaryDark": "#2f5d3d",
    "accent": "#c98a3b",
    "bg": "#f4f7f2"
  },
  "rubrics": [
    {"id":"care",        "name":"Уход за растениями", "emoji":"🪴", "color":"#3f7d52"},
    {"id":"plant-week",  "name":"Растение недели",    "emoji":"🌿", "color":"#5a9367"},
    {"id":"mistakes",    "name":"Ошибки новичков",    "emoji":"⚠️", "color":"#c97b3b"},
    {"id":"before-after","name":"До / после",         "emoji":"✨", "color":"#8a6cb0"},
    {"id":"propagation", "name":"Размножение",        "emoji":"🌱", "color":"#4f9d6b"},
    {"id":"lifehacks",   "name":"Лайфхаки",           "emoji":"💡", "color":"#d2a23a"},
    {"id":"personal",    "name":"Личное / за кадром", "emoji":"☕", "color":"#a8745a"},
    {"id":"qa",          "name":"Вопрос-ответ",       "emoji":"❓", "color":"#4a90c2"},
    {"id":"seasonal",    "name":"Сезонное",           "emoji":"🍂", "color":"#c0703a"},
    {"id":"roundups",    "name":"Подборки",           "emoji":"📋", "color":"#5b8a8c"},
    {"id":"pests",       "name":"Вредители и болезни","emoji":"🐛", "color":"#a14b4b"},
    {"id":"decor",       "name":"Декор и интерьер",   "emoji":"🖼️", "color":"#7e8b54"},
    {"id":"shopping",    "name":"Покупки и распаковки","emoji":"🛍️","color":"#bf6fa0"},
    {"id":"engagement",  "name":"Вовлечение (Stories)","emoji":"💬", "color":"#4aa3a0"}
  ],
  "trendQuery": "тренды Instagram Reels и контент про комнатные растения {month} {year}: популярные форматы видео, ходовые комнатные растения, вирусные темы и хэштеги для блога об уходе за растениями",
  "packaging": {
    "positioning": "Помогаю превратить дом в зелёные джунгли 🪴 Простой уход за комнатными растениями для тех, у кого «всё засыхает».",
    "name": "Имя · уход за растениями 🪴",
    "bio_ru": "🪴 Имя — растениевод-любитель\n🌿 Уход за комнатными простыми словами\n💡 Спасаю засохшее, делюсь лайфхаками\n👇 Забери бесплатный гайд для новичка",
    "bio_en": "🪴 Houseplant care made simple\n🌿 Tips, fixes & plant rescues\n💌 Honest, no Latin names\n👇 Grab my free beginner guide",
    "link": "Taplink:\n• Бесплатный гайд «7 неприхотливых растений»\n• Консультация по уходу / подбор растения\n• Отзывы\n• Telegram-канал",
    "highlights": "1) Старт — кто я и о чём блог\n2) Уход — база: полив, свет, пересадка\n3) Ошибки — частые промахи новичков\n4) До/после — спасённые растения\n5) Размножение — черенки и детки\n6) Подборки — топы растений\n7) Отзывы / благодарности\n8) Купить / консультация",
    "pinned": "1) Знакомство: кто я + за чем подписываться\n2) Польза-карусель: «7 неприхотливых растений»\n3) До/после или оффер: лучшая трансформация / услуга",
    "visual": "Палитра: зелёный + тёплый беж + белый\nОбложки каруселей: один шаблон, один шрифт, крупный заголовок\nФото: дневной свет, чистый фон\nОдин пресет/фильтр на все фото",
    "avatar": "Твоё лицо с растением на руках (живые блоги растут лучше) ИЛИ простой значок-листок на однотонном фоне.",
    "tone": "Тёплый, как подруга-мама. Простыми словами, без латыни и занудства. Честно про свои провалы. Поддерживаю новичков: «у тебя получится»."
  }
}
